{
  "schema_version": "rig_manifest.v1",
  "artifact_id": "art_aaaaaaaaaaaaaaaaaaaaaaaaaaaaaaaa",
  "rig_id": "rig_77777777777777777777777777777777",
  "rig_version_id": "rv_88888888888888888888888888888888",
  "asset_version_id": "av_aaaaaaaaaaaaaaaaaaaaaaaaaaaaaaaa",
  "parts_manifest_artifact_id": "art_88888888888888888888888888888888",
  "rig_layout_artifact_id": "art_11111111111111111111111111111111",
  "rig_joints_artifact_id": "art_22222222222222222222222222222222",
  "layout_sha256": "sha256:aaaaaaaaaaaaaaaaaaaaaaaaaaaaaaaaaaaaaaaaaaaaaaaaaaaaaaaaaaaaaaaa",
  "joints_sha256": "sha256:aaaaaaaaaaaaaaaaaaaaaaaaaaaaaaaaaaaaaaaaaaaaaaaaaaaaaaaaaaaaaaaa",
  "spine_json_artifact_id": "art_11111111111111111111111111111111",
  "atlas_text_artifact_id": "art_22222222222222222222222222222222",
  "atlas_png_artifact_id": "art_33333333333333333333333333333333",
  "rig_profile_artifact_id": "art_44444444444444444444444444444444",
  "qc_report_artifact_id": "art_55555555555555555555555555555555",
  "draw_order": [
    {
      "semantic_role": "torso",
      "z_index": 0
    },
    {
      "semantic_role": "head",
      "z_index": 1
    },
    {
      "semantic_role": "left_upper_arm",
      "z_index": 2
    },
    {
      "semantic_role": "left_forearm",
      "z_index": 3
    },
    {
      "semantic_role": "left_hand",
      "z_index": 4
    },
    {
      "semantic_role": "right_upper_arm",
      "z_index": 5
    },
    {
      "semantic_role": "right_forearm",
      "z_index": 6
    },
    {
      "semantic_role": "right_hand",
      "z_index": 7
    },
    {
      "semantic_role": "left_thigh",
      "z_index": 8
    },
    {
      "semantic_role": "left_shin",
      "z_index": 9
    },
    {
      "semantic_role": "left_foot",
      "z_index": 10
    },
    {
      "semantic_role": "right_thigh",
      "z_index": 11
    },
    {
      "semantic_role": "right_shin",
      "z_index": 12
    },
    {
      "semantic_role": "right_foot",
      "z_index": 13
    }
  ],
  "status": "needs_review"
}
